{
  "schema": "crablink.wallet.balance.v1",
  "account": "acct_dev",
  "unit": "ROC",
  "available_minor_units": "1776",
  "held_minor_units": "0",
  "display": "1776 ROC",
  "as_of": null,
  "ledger_backed": true,
  "source": "svc_wallet.v1",
  "reason": "wallet_balance_from_svc_wallet",
  "warnings": []
}